{
  "schema_version": 1,
  "meta": {
    "title": "Team weekly — Core platform",
    "generated_at": "2026-04-28T12:00:00Z",
    "team": "Core platform",
    "report_kind": "team-weekly",
    "subtitle": "Week of 2026-04-21"
  },
  "sections": [
    {
      "id": "highlights",
      "title": "Highlights",
      "body_markdown": "- Shipped **auth hardening** behind the feature flag `auth_harden_v2`; zero Sev1.\n- **On-call** was quiet; one P3 rolled to next week.\n- **CI** median pipeline under **8 minutes** after cache tuning."
    },
    {
      "id": "risks",
      "title": "Risks",
      "body_markdown": "- **Dependency** upstream SDK releases a breaking API in **June** — tracking vendor RFC **RFC-901**.\n- **Capacity:** two engineers OOO next sprint; scope freeze on net-new features."
    },
    {
      "id": "metrics",
      "title": "Metrics snapshot",
      "body_markdown": "| Metric | This week | Notes |\n|--------|-----------|------|\n| MTTR | 45m | Within SLO |\n| Deploy frequency | 3/day | Stable |"
    },
    {
      "id": "throughput",
      "title": "Merge throughput",
      "body_markdown": "Sustained increase after CI cache fix in week 2.",
      "chart": {
        "type": "bar",
        "title": "Merged PRs per week",
        "labels": ["W1", "W2", "W3", "W4"],
        "datasets": [
          {
            "label": "Merged",
            "data": [12, 19, 15, 22],
            "backgroundColor": "rgba(14, 165, 233, 0.45)"
          }
        ],
        "options": {
          "y_axis_begin_at_zero": true
        }
      }
    },
    {
      "id": "next",
      "title": "Next week focus",
      "body_markdown": "1. Finish flag rollout to **10%** canary.\n2. Pair on runbook for dependency migration.\n3. Dry-run **June** SDK upgrade in staging."
    }
  ],
  "links": [
    { "label": "Sprint board", "url": "https://jira.example.com/board" },
    { "label": "Team dashboard", "url": "https://metrics.example.com/team/core" }
  ]
}
